username,rating,date,review_text,pros,cons
Dayana A.,5,22 minutes ago,I love these slides. I have wide feet and they are not tight at all. They are VERY comfortable I wear them around the house. I'll definitely bit more to wear ...,,
.,5,1 hour ago,Muy buen estilo son cómodas y duradera se ajustan a tu pie y podrás caminar con comodidad material de muy buena calidad color adactada a tu estilo,,
Tatiana L.,5,1 hour ago,"Duración increíble,comodidad máxima el estilo me encanta,la calidad muy buena y la talla se ajusta a la adecuada,las recomiendo totalmente para cualquier persona",,
Samika M.,5,1 hour ago,They are the most comfortable slides out there. I use them while running errands or beach vacations.Literally the best. Using them since two years now and gonna buy some for the rest of my family as well.,,
Rossella M.,5,1 hour ago,"Ciabatte Nike che ormai hanno 12 anni.. iper resistenti e iper comode.. nonostante tutti questi anni sono ancora belle, il design è quello classico della Nike. Ideali sia per donna che per uomo. Le consiglio sia per la comodità ma anche per la traspirazione e la misura, unica pecca il prezzo in quanto costano veramente tanto..",,
Swetha K.,5,2 hours ago,"Super comfortable and stylish — perfect for everyday wear or after workouts. The cushioned sole and soft strap make them easy to wear for hours. Durable, easy to clean, and look great. Solid choice for casual comfort.",,
Ashley K.,5,2 hours ago,"These slides are very versatile, comfortable and stylish. Whether it's a day at the beach or a stroll through town, these slides are built to last. Fit is true to size as well.",,
Keyli R.,5,2 hours ago,"El material de estas sandalias es de muy buena calidad, duradero, son muy suaves para caminar, puedes usarlas con diferentes estilos, están muy hermosas y elegantes",,
Sonia S.,5,2 hours ago,"Me encantan además de bonitas son super cómodas, es mi estilo y queda genial tanto para ir a la playa o piscina como para ir en vaqueros quedan muy chulas",,
Montserrat I.,5,3 hours ago,Estas chanclas están diseñadas oara ofrecer comodidad y soporte los que la hacen ideales para el uso diario especialmente en climas cálidos para actividades acuáticas,,
Maggie G.,5,3 hours ago,"I only wear slides. And these are the most comfortable pair I own. Normally my feet start to hurt or the sides will rub blisters, but I haven’t had any issues out of these.",,
Geraldine A.,5,3 hours ago,"Con este producto obtienes comodidad extrema en comparación a otros modelos ,la calidad del material y suavidad es lo que más satisfecha me tiene,cuenta con un estilo moderno sin dejar de ser elegante la medida corresponde y noto una larga durabilidad las recomiendo",,
Kate M.,5,3 hours ago,"This is such a good style it’s so supportive,Durable and perfect for a comfortable fit.I really like these i use them for everything and i will definitely be buying more",,
Sandra V.,5,4 hours ago,"I’ve been wearing my Nike Benassi Swoosh slides for years now and honestly, I still love them. The footbed is nice and cushioned – even after standing or walking around for a while my feet feel great. The classic Nike swoosh design on the strap is super sleek, so they go with pretty much any casual outfit. Best of all, I’ve worn these all summer after summer and they’ve held up like champs – no cracks, no fading, just as comfy and stylish as day one.",,
Kristen S.,5,4 hours ago,Love this so comforting n comfortable I wear theses all the time my favorite shoe love them n I love these sandals would get them again n same color,,
Fanny L.,5,5 hours ago,"Elle sont super confortable, vraiment très peu cher pour la marque, elle taille plutôt bien, par contre elle s’abîme assez vite c’est dommage !",,
Taylor S.,5,5 hours ago,"This is my 3rd pair. (one set i lost and another i ruined with paint....) They are hard on the feet until broken in. But are the most comfortable, long term slides ever. Highly recommended",,
Yvonne G.,5,5 hours ago,"I e had these slides for 5+ years, and while they’re worn and well loved, they are still holding up strong with daily use. I wear them out and about and around the house. They are so comfortable and durable. Classic style, that can be dressed up or down. I will be replacing mine with the same ones when the time comes.",,
Pauline C.,5,6 hours ago,"The rubber material is comfortable, and it's seems to be waterproof. Fits perfect. Material is great.These are pretty strong my son literally love and cherish these slides",,
Bielkis J.,5,6 hours ago,"Son cómodos, es acorde a la talla ya que muchos pares de chanclas vienen más grandes o pequeñas, la calidad es 8/10 y son durable siempre y cuando sepas cuidarla. El estilo es casual",,
Abdellatif F.,5,6 hours ago,Très jolie claquettes de piscine ou pour aller à la plage Elles sont solides et surtout pratiques Elles sont aussi antidérapante Un confort assuré qui donne du style,,
Taylor T.,5,6 hours ago,"these are the perfect shoe to slip on for quick outtings for errands and are so comfortable and cute! they don’t bother make the annoying sandal sound like most sandals of this style, and they don’t rub my foot like some sandals do.",,
Joric P.,4,7 hours ago,"Ik heb de Nike Benassi Swoosh Slides gescoord en ik ben fan! Ze zitten echt lekker, met een zachte band en een zool die je voeten pampert. Ideaal om thuis te chillen, even naar de winkel te sjezen of na het sporten. Ze zien er ook gewoon tof uit met die vette Swoosh, past bij alles. Qua maat zitten ze goed, maar de band was eerst een tikkie strak omdat m’n voeten wat breder zijn. Na een paar keer dragen top. Ze voelen stevig, zijn zo schoon, en voor €35 vind ik ze echt een steal. Alleen niet super voor natte plekken, want de band zuigt wat water op. Echt een chille slide voor elke dag! ⭐️⭐️⭐️⭐️ (4/5)",,
Maria Candida T.,5,7 hours ago,Ho comprato queste ciabatte per abbinarle al costume mare di mio marito sono comodissime le porta anche in casa misura perfetta molto durevoli,,
Nicola J.,5,8 hours ago,I absolutely love these Nike slides. They are so comfortable my feet is in heaven when i wear them. Also by looking at the material you can see that it’s durable. You will get your money’s worth guys.,,
Fabian A.,5,8 hours ago,"Very comfortable, super recommended I used them several semany for different types of activities, they look great for going out for a walk.They are of very good quality and also the material with which they were made is comfortable",,
Andrea T.,5,9 hours ago,Misure alla portata di tutti qualità di materiale marca Nike stile egregio comode anzi comodissime e durature nel tempo non si rompono mai ma proprio mai,,
Oluwabukola A.,5,10 hours ago,Go to slides. This is highly comfortable and stylish. It’s also very durable and has a sleek fit on the feet. Value for money . I love it and it’s one of he best things I have purchased,,
Darren J.,5,10 hours ago,Really like wearing these either on the beach or just at home. Comfortable fit with good support and durability is very good as is the quality. Would buy again,,
Pati B.,5,12 hours ago,They fit and support your feet very well. They are durable and stylish too! I recommend getting these! They are super comfortable and you can use them anywhere.,,
Maria H.,5,13 hours ago,"Sooo comfortable I think I have these in every color They are my goto for the beach, a quick trip down the street or even a casual all day event. They last forever and never go out of style.",,
Harmony S.,5,14 hours ago,"I’ve been using the Nike Benassi Swoosh Slides for a while now, and they’ve become my go-to for casual wear, especially in warmer weather. The comfort is next level – the footbed feels cushioned and supportive, even after hours of wear. They fit true to size, have a sleek, sporty look, and are super durable; I’ve used mine at the beach, around the house, and even for quick errands. I love how easy they are to slip on, and the quality has stayed consistent despite frequent use and it’s cute",,
Evgenia B.,5,15 hours ago,"Very comfortable shoes. Easy to put on and off. Everyone in my family has them! Wear them out everyday, they are especially useful when I take my sun to soccer so that he can easily change his cleats.",,
Saucyyy L.,5,15 hours ago,"This slides are my go-to for daily wear. The fit is true to size, and the soft cushioning makes them super comfy even after hours of use. They’re lightweight, breathable, and easy to slip on—perfect for quick errands or chilling at home. The grip on the sole prevents slipping, and the strap feels secure without digging into my foot. I’ve worn them nonstop and they’ve held up great, even with rough use. Definitely a staple in my footwear rotation.",,
Bernardina D.,4,16 hours ago,La comodidad es increíble el estilo que leda a la ropa la durabilidad es magistral la calidad es estupenda las amo son mis favoritas son agradables,,
Rose A.,5,18 hours ago,"I have had these slides for about a year and a half, and they are doing great. They are comfortable and so easy to put outfits with. They fit pretty well depending on your foot size, but they are also really good-lasting and fit nice around your feet, not too tight or loose. They are just perfect.",,
Joan G.,1,18 hours ago,Did not like them. Uncomfortable with no arch support. They look like prison shoes. Not very attractive. The velcro was not tight enough and they slipped around on my feet.,,
"Buy Xanax, Telegram: @Bipmenow ..",5,18 hours ago,The price range is perfect and you don’t have to spend too much. The customer service and return policy is amazing. And there are so many items (meds) to choose from. Also the shipping speed was super-fast. Details on Photo.,,
Sonia R.,5,19 hours ago,I love them especially when going through airport security. Very comfortable matches with any clothes super comfortable. I will definitely buy them again .,,
Shazia Wali S.,4,19 hours ago,Great for everyday wear. Goes well with any outfit wheather it be indoors or out. It has great quality that you can depend on and expect for a big brand like nike,,
Callie M.,4,19 hours ago,They are comfy and don’t slide off your feet while walking and are very trendy and in style right now too and they’re very durable. I would recommend!,,
Lisa F.,5,20 hours ago,I buy these for my husband and he loves them. They are comfortable and stylish. They are the perfect slides. They are very durable and last a long time.,,
Quynh N.,5,21 hours ago,This sandals are so comfortable to wear daily. I took it a long way but still did not have any feet pain. It is simple in style but still young and modern. It is also fitted and true in my size.,,
Jacquie G.,5,21 hours ago,Very easy to slip on and very comfortable for a lazy day off of work. They are very durable and these are my second pair. They last a long time. I would buy them in all colors.,,
Synsyn B.,4,22 hours ago,Super confortable… j’adore particulièrement ce design… j’wi le mien depuis quelques années il est comme neuf.. le prix est abordable. Je vous le conseille vivement,,
Bree E.,5,22 hours ago,Love these slides. They are my house slides. Super comfortable. Supportive of the arch in my foot. Ive had them for three years and theyre still in great shape. And they are breathable so my feet dont get sweaty and stinky.,,
Jessica D.,5,1 day ago,"These Nike Benassi Swoosh Slides are exactly what I needed—simple, stylish, and ridiculously comfortable. The footbed has just the right amount of cushion, so they offer great support . Super easy to slide on when I’m heading out or just lounging around. Bonus: they’re lightweight but feel durable and offer , so I don’t worry about them wearing out anytime soon. If you’re after a no-fuss, wear-them-everywhere kind of slide, this is it.",,
Cindy N.,5,1 day ago,"I have they for 2?years but it still holding up so well ! Nike are pretty popular model, they are very comfortable to wear and they’re very flexible suble for a lot of weather types and it very easy to clean!!! I love them",,
